<?xml version="1.0" encoding="UTF-8"?>
<grammar xmlns="http://lolxml.org" xmlns:xsi="http://www.w3.org/2001/XMLSchema-instance" xsi:schemaLocation="http://lolxml.org ../../main/resources/lolxml.xsd ">

  <data>
      <farm xmlns="">
      	<animal name="duck"><sound>quack</sound></animal>
      	<animal name="cow"><sound>moo</sound></animal>
      </farm>
  </data>
  
  <exp id="selectAnimal" value="farm/animal[@name=$animalName]"/>
  
  <sym id="NAME"><switch>
      <case>duck</case>
      <case>cow</case></switch></sym>
      
  <sym id="ROOT">
    <store property="animalName" idref="NAME" />
    <store property="animal" idRef="selectAnimal" type="node"/>
    <store property="sound"><exp value="$animal/sound"/></store>
    <store property="sound.x2"><exp value="concat($sound,'-',$sound)" /></store>
    Old MacDonald had a farm, E-I-E-I-O,
    And on that farm he had a <eval property="animalName"/>, E-I-E-I-O,
    With a <eval property="sound.x2"/> here and a <eval property="sound.x2"/> there
    Here a <eval property="sound"/>, there a <eval property="sound"/>, everywhere a <eval property="sound.x2"/>
    Old MacDonald had a farm, E-I-E-I-O. 
  </sym>
      
  <eval idref="ROOT"/>

</grammar>
